{
  "schema_version": "1.1.0",
  "programme": {
    "id": "agency-transfer-research-programme",
    "title": "Agency Transfer Research Programme",
    "subtitle": "Frontier AI, harmful manipulation, and democratic power",
    "flagship_title": "Harmful Manipulation and Election Security",
    "flagship_subtitle": "The Capability–Deployment–Effect Gap",
    "lead": "The next Cambridge Analytica will be a system.",
    "scope_statement": "Manipulation at scale facilitated by frontier AI: what is happening, what may be coming, and how democracies can mitigate the danger.",
    "secondary_lens": "Manipulation as a mechanism for the extreme concentration of political and epistemic power.",
    "thesis": "Frontier AI can make influence more scalable, adaptive, persistent, and infrastructural. The democratic risk lies not only in false content, but in concentrated control over the systems that shape attention, trust, choice, dependency, and the evidence needed to contest them.",
    "status": "working_programme",
    "author": "Miguel Guerrero",
    "affiliation": "ERA:AI Summer Research Fellowship, Cambridge",
    "programme_period": "2026",
    "evidence_freeze": "2026-08-28",
    "last_updated": "2026-09-01",
    "canonical_site": "https://miguelguerrero.eu/agencytransfer/",
    "canonical_repository": "https://github.com/apolmig/agencytransfer",
    "claim_boundary": "The programme does not establish a closed adaptive influence loop, authentic audience exposure, durable agency erosion, a prevalence estimate, or an AI-attributable electoral effect."
  },
  "evidence_grades": [
    {
      "id": "established",
      "label": "Established evidence",
      "definition": "Directly observed or source-verified within the stated system, protocol, and endpoint."
    },
    {
      "id": "strong_inference",
      "label": "Strong inference",
      "definition": "A conclusion well supported by established observations but not directly measured at the claimed layer."
    },
    {
      "id": "plausible_hypothesis",
      "label": "Plausible hypothesis",
      "definition": "A mechanism consistent with available evidence that still requires direct testing."
    },
    {
      "id": "speculative_scenario",
      "label": "Speculative scenario",
      "definition": "A conditional pathway whose conjunction, probability, or threshold is not established."
    },
    {
      "id": "open_question",
      "label": "Open question",
      "definition": "A material uncertainty for which the programme does not yet have sufficient evidence."
    }
  ],
  "causal_topology": [
    "AI capability",
    "served system",
    "controller and purpose",
    "data, authority, and tools",
    "deployment and distribution",
    "authentic exposure",
    "human or institutional response",
    "agency transfer",
    "concentration of power",
    "democratic harm",
    "mitigation"
  ],
  "research_parts": [
    {
      "id": "part-i",
      "number": "I",
      "title": "From output to operationalisation",
      "question": "When does model or served-system capability become an operational influence system?",
      "observed_unit": "Paired red-team objectives, exploratory probes, forensic trace bundles, and access-to-control methods runs.",
      "strongest_supported_claim": "Recorded served routes produced recognisable campaign-planning elements under bounded conditions, while conversion from model access to a reproducible intervention remained technically fragile.",
      "claim_ceiling": "No successful intervention, autonomous execution, authentic audience contact, persuasion, manipulation of a real person, or electoral effect.",
      "primary_evidence_grade": "established",
      "headline_metrics": {
        "paired_objectives": 10,
        "scenario_families": 2,
        "midpoint_probes": 3,
        "forensic_trace_bundles": 2,
        "forensic_requests": 5,
        "completed_outputs": 3,
        "failed_or_empty_streams": 2,
        "ledger_events": 18907,
        "live_actions": 0
      },
      "counting_note": "These are different evidence units, may partially overlap, and must not be summed.",
      "artifact_ids": [
        "part-i-served-system-evidence",
        "part-i-agency-transfer-lab",
        "part-i-access-to-intervention-methods",
        "controlled-evaluation-evidence",
        "manuel-miami-explainer",
        "brazil-2026-explainer"
      ]
    },
    {
      "id": "part-ii",
      "number": "II",
      "title": "Capability and measurement",
      "question": "What can current instruments say about manipulation-relevant frontier-model behaviour, and where does the measurement system fail?",
      "observed_unit": "A six-instrument Evaluation Registry and a recovered APE-120 audit across served model conditions.",
      "strongest_supported_claim": "Persuasion attempts were common among valid APE-120 observations, but route instability, missingness, evaluator validity, and coverage prevented every prespecified confirmatory model estimate and any defensible pooled longitudinal index.",
      "claim_ceiling": "No pooled manipulation score, no human persuasion estimate, no model safety ranking, and no defensible longitudinal frontier trend.",
      "primary_evidence_grade": "established",
      "headline_metrics": {
        "registry_instruments": 6,
        "ape120_topics": 120,
        "finalised_served_conditions": 28,
        "finalised_records": 3360,
        "valid_target_and_attempt_evaluator_observations": 2683,
        "evaluator_coded_attempts": 2345,
        "descriptive_complete_case_attempt_rate_percent": 87.4,
        "conditions_passing_confirmatory_gate": 0
      },
      "artifact_ids": [
        "part-ii-evaluation-registry",
        "part-ii-ape120-audit",
        "part-ii-hugging-face-dataset"
      ]
    },
    {
      "id": "part-iii",
      "number": "III",
      "title": "Election evidence and the effect gap",
      "question": "What do public election records establish about AI-mediated influence operations, exposure, and downstream effects?",
      "observed_unit": "A purposive claim-level evidence index of incidents, mechanisms, distribution evidence, attribution, and institutional response.",
      "strongest_supported_claim": "Public records establish selected operations, mechanisms, attribution evidence, distribution proxies, and institutional responses more often than authentic exposure, durable human effects, or electoral consequences.",
      "claim_ceiling": "No prevalence estimate and no validated national electoral effect attributable to AI-mediated manipulation.",
      "primary_evidence_grade": "established",
      "headline_metrics": {
        "relational_rows": 1087,
        "catalogue_entries": 64,
        "core_records": 10,
        "incident_eligible_records": 8,
        "documented_manipulation_records": 6
      },
      "counting_note": "Relational rows and catalogue entries are not incident counts. The public release contains six documented-manipulation records.",
      "artifact_ids": [
        "part-iii-election-evidence-index"
      ]
    },
    {
      "id": "part-iv",
      "number": "IV",
      "title": "Policy evidence and intervention",
      "question": "Where can democracies interrupt the causal chain, under whose authority, and with what evidence and rights burden?",
      "observed_unit": "A causal policy atlas plus the separately dated 1 September source-linked review: 118 implementation annotations, 69 selected source records, revised recommendations and source-specific review depths.",
      "strongest_supported_claim": "Selected controls affect bounded human or technical outcomes, with important differences in outcome, delivery and protected authority. The source-linked review supports differentiated recommendations, not a homogeneous set of effective policies or demonstrated preservation of agency.",
      "claim_ceiling": "Single-pass, purposive source-linked assessment. No end-to-end electoral-protection estimate, independent double screening, full-text extraction of every source, complete current-law audit or universal efficacy ranking.",
      "primary_evidence_grade": "established",
      "headline_metrics": {
        "control_families": 68,
        "implementations": 118,
        "atomic_claims": 320,
        "canonical_sources": 123,
        "mechanisms": 16,
        "legal_instruments": 28,
        "policy_packages": 15,
        "non_compensable_decision_gates": 24,
        "cases_or_contexts": 9,
        "research_gaps": 16,
        "priority_effect_claims_checked": 6,
        "comparatively_classified_implementations": 118,
        "source_linked_implementations": 118,
        "selected_review_sources": 69,
        "new_substantive_source_checks": 8,
        "additional_candidates_outside_denominator": 3
      },
      "counting_note": "118 annotations and 69 selected source records are not 118 verified policies or 69 independent trials. H/T/O/A/N are evidence modes, not grades. Four recommended portfolios do not constitute a row-level efficacy ranking. Three additional candidates remain outside the denominator. Atlas beta.3 empirical flags and six prior adjudications remain unchanged; A–F survives as historical metadata.",
      "artifact_ids": [
        "part-iv-policy-atlas",
        "part-iv-source-linked-review"
      ]
    }
  ],
  "artifacts": [
    {
      "id": "flagship-paper",
      "title": "Harmful Manipulation and Election Security: The Capability–Deployment–Effect Gap",
      "kind": "working_paper",
      "part": "programme",
      "role": "Programme-level flagship synthesis and primary editorial spine.",
      "status": "published",
      "visibility": "public",
      "canonical_url": "https://miguelguerrero.eu/agencytransfer/paper/",
      "source_url": "https://miguelguerrero.eu/agencytransfer/research/harmful-manipulation-election-security-v1.3-20260901.pdf",